{
  "$schema": "../mission-package.schema.json",
  "schema_version": 1,
  "id": "m014",
  "title": "第十五关：破晓密令",
  "mode": "composite",
  "selector_level": 15,
  "engine_mission": 7,
  "runtime_vwf": "1937M014.VWF",
  "source_vwf": "Mod/1937m006.vwf",
  "output_vwf": "Mod/1937m014.vwf",
  "blueprint_definition": "MapEditor/Missions/m014/blueprint.json",
  "composition_report": "MapEditor/Missions/m014/composition.md",
  "composed_work_file": "1937m014-composed.vwf",
  "mission_definition": "MapEditor/Missions/m014/mission.json",
  "mission_report": "MapEditor/Missions/m014/validation.md",
  "preview_source_terrain": "MapEditor/Assets/Original/maps/m006/terrain.png",
  "preview_output_directory": "MapEditor/Assets/Original/maps/m014",
  "expected_output_sha256": "BA14A6B5C76700586898BAAC3D6983119F3A48774A82CFF4363D81F4B4A8EF17"
}
