{
  "$schema": "../mission-package.schema.json",
  "schema_version": 1,
  "id": "mNNN",
  "title": "第 N 关：关卡名称",
  "mode": "redeploy",
  "selector_level": 16,
  "engine_mission": 1,
  "runtime_vwf": "1937MNNN.VWF",
  "source_vwf": "Mod/1937m000.vwf",
  "output_vwf": "Mod/1937mNNN.vwf",
  "mission_definition": "MapEditor/Missions/mNNN/mission.json",
  "mission_report": "MapEditor/Missions/mNNN/validation.md",
  "expected_output_sha256": "0000000000000000000000000000000000000000000000000000000000000000"
}
