{
  "$schema": "../mission-package.schema.json",
  "schema_version": 1,
  "id": "m013",
  "title": "第十四关：锄奸行动",
  "mode": "redeploy",
  "selector_level": 14,
  "engine_mission": 7,
  "runtime_vwf": "1937M013.VWF",
  "source_vwf": "Mod/1937m006.vwf",
  "output_vwf": "Mod/1937m013.vwf",
  "mission_definition": "MapEditor/Missions/m013/mission.json",
  "mission_report": "MapEditor/Missions/m013/validation.md",
  "expected_output_sha256": "1D806244F6F930FAD56C1B584C49369022B8C604CE7CB5D616608AB05B3460E3"
}
